{
  "agent_id": "03_evidence_dataset_scout",
  "schema_version": "1.0.0",
  "created_at": "2026-06-21T02:02:36Z",
  "provenance": [
    {
      "source_type": "mock",
      "source_id": "03_evidence_dataset_scout",
      "note": "Deterministic mock output for pipeline testing; not a verified public accession."
    }
  ],
  "warnings": [],
  "blocking_failures": [],
  "claim_ceiling": {
    "max_allowed_claim": "co_expression",
    "reason": "Mock datasets support tissue-level association and co-expression, not causality."
  },
  "normalized_question_ref": "02_scope_ontology_resolver",
  "analogous_studies": [
    {
      "study_id": "MOCK-STUDY-ADIPOSE-ASSOC-001",
      "source_type": "mock",
      "source_identifier": "MOCK-STUDY-ADIPOSE-ASSOC-001",
      "relevance": "Mock adipose bulk expression study aligned to inflammatory association screening.",
      "supports": [
        "tissue-level disease-control contrast",
        "molecule-program association screening"
      ],
      "does_not_support": [
        "causal driver status",
        "validated extracellular accessibility"
      ],
      "provenance": {
        "source_type": "mock",
        "source_id": "MOCK-STUDY-ADIPOSE-ASSOC-001",
        "note": "Deterministic mock output for pipeline testing; not a verified public accession."
      }
    },
    {
      "study_id": "MOCK-STUDY-ADIPOSE-SCRNA-002",
      "source_type": "mock",
      "source_identifier": "MOCK-STUDY-ADIPOSE-SCRNA-002",
      "relevance": "Mock adipose single-cell study aligned to fallback localization review.",
      "supports": [
        "cell-type localization review",
        "expression context for candidate molecules"
      ],
      "does_not_support": [
        "well-powered T2D case-control ranking",
        "functional secretion validation"
      ],
      "provenance": {
        "source_type": "mock",
        "source_id": "MOCK-STUDY-ADIPOSE-SCRNA-002",
        "note": "Deterministic mock output for pipeline testing; not a verified public accession."
      }
    }
  ],
  "dataset_candidates": [
    {
      "dataset_id": "MOCK-GSE-T2D-ADIPOSE-001",
      "repository": "GEO",
      "accession": "MOCK-GSE-T2D-ADIPOSE-001",
      "organism": "Homo sapiens",
      "tissue": "adipose tissue",
      "assay_type": "bulk RNA-seq",
      "sample_size": 84,
      "metadata_fields": [
        "disease_status",
        "adipose_depot",
        "sex",
        "body_mass_index",
        "batch"
      ],
      "data_availability": [
        "processed_matrix",
        "sample_metadata"
      ],
      "supports": [
        "tissue-level differential expression context",
        "molecule-program association screening"
      ],
      "does_not_support": [
        "cell-type source attribution",
        "causal inference"
      ],
      "feasibility_score": 88,
      "recommendation": "primary",
      "provenance": {
        "source_type": "mock",
        "source_id": "MOCK-GSE-T2D-ADIPOSE-001",
        "note": "Deterministic mock output for pipeline testing; not a verified public accession."
      }
    },
    {
      "dataset_id": "MOCK-CELLXGENE-ADIPOSE-002",
      "repository": "CELLxGENE",
      "accession": "MOCK-CELLXGENE-ADIPOSE-002",
      "organism": "Homo sapiens",
      "tissue": "adipose tissue",
      "assay_type": "scRNA-seq",
      "sample_size": 126000,
      "metadata_fields": [
        "cell_type",
        "donor_status",
        "adipose_depot"
      ],
      "data_availability": [
        "count_matrix",
        "cell_metadata"
      ],
      "supports": [
        "fallback cell-type localization",
        "candidate expression context review"
      ],
      "does_not_support": [
        "high-confidence case-control ranking by itself",
        "validated surface accessibility"
      ],
      "feasibility_score": 72,
      "recommendation": "fallback",
      "provenance": {
        "source_type": "mock",
        "source_id": "MOCK-CELLXGENE-ADIPOSE-002",
        "note": "Deterministic mock output for pipeline testing; not a verified public accession."
      }
    },
    {
      "dataset_id": "MOCK-GSE-LIVER-003",
      "repository": "GEO",
      "accession": "MOCK-GSE-LIVER-003",
      "organism": "Homo sapiens",
      "tissue": "liver",
      "assay_type": "bulk RNA-seq",
      "sample_size": 40,
      "metadata_fields": [
        "disease_status"
      ],
      "data_availability": [
        "processed_matrix"
      ],
      "supports": [
        "generic T2D expression background"
      ],
      "does_not_support": [
        "adipose tissue specificity",
        "direct support for the user question"
      ],
      "feasibility_score": 18,
      "recommendation": "reject",
      "provenance": {
        "source_type": "mock",
        "source_id": "MOCK-GSE-LIVER-003",
        "note": "Deterministic mock output for pipeline testing; not a verified public accession."
      }
    }
  ],
  "answerable_parts": [
    "Rank candidate secreted or surface molecules associated with inflammatory activation in T2D adipose tissue.",
    "Use fallback single-cell evidence to localize candidate expression by cell type.",
    "Summarize which claims remain candidate-level only."
  ],
  "unanswerable_parts": [
    "Causal driver status for insulin resistance or inflammation.",
    "Experimentally confirmed secretion or true extracellular accessibility.",
    "Validated therapeutic target readiness."
  ],
  "no_suitable_dataset": false,
  "recommended_dataset_ids": [
    "MOCK-GSE-T2D-ADIPOSE-001",
    "MOCK-CELLXGENE-ADIPOSE-002"
  ]
}
